{
  "subcommands": [
    {
      "subcommands": [],
      "options": [
        {
          "option": "-h",
          "shortcut": "--help",
          "description": "help for completion"
        },
        {
          "option": "-C",
          "shortcut": "--colors",
          "description": "force print with colors"
        },
        {
          "option": "",
          "shortcut": "--csv-auto-parse",
          "description": "parse CSV YAML/JSON values",
          "default": "true"
        },
        {
          "option": "",
          "shortcut": "--csv-separator",
          "description": "CSV Separator character",
          "default": ","
        },
        {
          "option": "",
          "shortcut": "--debug-node-info",
          "description": "debug node info"
        },
        {
          "option": "-e",
          "shortcut": "--exit-status",
          "description": "set exit status if there are no matches or null or false is returned"
        },
        {
          "option": "",
          "shortcut": "--expression",
          "description": "forcibly set the expression argument. Useful when yq argument detection thinks your expression is a file."
        },
        {
          "option": "",
          "shortcut": "--from-file",
          "description": "Load expression from specified file."
        },
        {
          "option": "-f",
          "shortcut": "--front-matter",
          "description": "(extract|process) first input as yaml front-matter. Extract will pull out the yaml content, process will run the expression against the yaml content, leaving the remaining data intact"
        },
        {
          "option": "",
          "shortcut": "--header-preprocess",
          "description": "Slurp any header comments and separators before processing expression.",
          "default": "true"
        },
        {
          "option": "-I",
          "shortcut": "--indent",
          "description": "sets indent level for output",
          "default": "2"
        },
        {
          "option": "-i",
          "shortcut": "--inplace",
          "description": "update the file in place of first file given."
        },
        {
          "option": "-p",
          "shortcut": "--input-format",
          "description": "[auto|a|yaml|y|json|j|props|p|csv|c|tsv|t|xml|x|base64|uri|toml|lua|l|ini|i] parse format for input.",
          "default": "\"auto\""
        },
        {
          "option": "",
          "shortcut": "--lua-globals",
          "description": "output keys as top-level global variables"
        },
        {
          "option": "",
          "shortcut": "--lua-prefix",
          "description": "prefix",
          "default": "\"return \""
        },
        {
          "option": "",
          "shortcut": "--lua-suffix",
          "description": "suffix",
          "default": "\";\n\""
        },
        {
          "option": "",
          "shortcut": "--lua-unquoted",
          "description": "output unquoted string keys (e.g. {foo=\"bar\"})"
        },
        {
          "option": "-M",
          "shortcut": "--no-colors",
          "description": "force print with no colors"
        },
        {
          "option": "-N",
          "shortcut": "--no-doc",
          "description": "Don't print document separators (---)"
        },
        {
          "option": "-0",
          "shortcut": "--nul-output",
          "description": "Use NUL char to separate values. If unwrap scalar is also set, fail if unwrapped scalar contains NUL char."
        },
        {
          "option": "-n",
          "shortcut": "--null-input",
          "description": "Don't read input, simply evaluate the expression given. Useful for creating docs from scratch."
        },
        {
          "option": "-o",
          "shortcut": "--output-format",
          "description": "[auto|a|yaml|y|json|j|props|p|csv|c|tsv|t|xml|x|base64|uri|toml|shell|s|lua|l|ini|i] output format type.",
          "default": "\"auto\""
        },
        {
          "option": "-P",
          "shortcut": "--prettyPrint",
          "description": "pretty print, shorthand for '... style = \"\"'"
        },
        {
          "option": "",
          "shortcut": "--properties-array-brackets",
          "description": "use [x] in array paths (e.g. for SpringBoot)"
        },
        {
          "option": "",
          "shortcut": "--properties-separator",
          "description": "separator to use between keys and values",
          "default": "\" = \""
        },
        {
          "option": "",
          "shortcut": "--security-disable-env-ops",
          "description": "Disable env related operations."
        },
        {
          "option": "",
          "shortcut": "--security-disable-file-ops",
          "description": "Disable file related operations (e.g. load)"
        },
        {
          "option": "-s",
          "shortcut": "--split-exp",
          "description": "print each result (or doc) into a file named (exp). [exp] argument must return a string. You can use $index in the expression as the result counter. The necessary directories will be created."
        },
        {
          "option": "",
          "shortcut": "--split-exp-file",
          "description": "Use a file to specify the split-exp expression."
        },
        {
          "option": "",
          "shortcut": "--string-interpolation",
          "description": "Toggles strings interpolation of \\(exp)",
          "default": "true"
        },
        {
          "option": "",
          "shortcut": "--tsv-auto-parse",
          "description": "parse TSV YAML/JSON values",
          "default": "true"
        },
        {
          "option": "-r",
          "shortcut": "--unwrapScalar",
          "description": "unwrap scalar, print the value with no quotes, colors or comments.",
          "default": "true"
        },
        {
          "option": "-v",
          "shortcut": "--verbose",
          "description": "verbose mode"
        },
        {
          "option": "",
          "shortcut": "--xml-attribute-prefix",
          "description": "prefix for xml attributes",
          "default": "\"+@\""
        },
        {
          "option": "",
          "shortcut": "--xml-content-name",
          "description": "name for xml content (if no attribute name is present).",
          "default": "\"+content\""
        },
        {
          "option": "",
          "shortcut": "--xml-directive-name",
          "description": "name for xml directives (e.g. <!DOCTYPE thing cat>)",
          "default": "\"+directive\""
        },
        {
          "option": "",
          "shortcut": "--xml-keep-namespace",
          "description": "enables keeping namespace after parsing attributes",
          "default": "true"
        },
        {
          "option": "",
          "shortcut": "--xml-proc-inst-prefix",
          "description": "prefix for xml processing instructions (e.g. <?xml version=\"1\"?>)",
          "default": "\"+p_\""
        },
        {
          "option": "",
          "shortcut": "--xml-raw-token",
          "description": "enables using RawToken method instead Token. Commonly disables namespace translations. See https://pkg.go.dev/encoding/xml#Decoder.RawToken for details.",
          "default": "true"
        },
        {
          "option": "",
          "shortcut": "--xml-skip-directives",
          "description": "skip over directives (e.g. <!DOCTYPE thing cat>)"
        },
        {
          "option": "",
          "shortcut": "--xml-skip-proc-inst",
          "description": "skip over process instructions (e.g. <?xml version=\"1\"?>)"
        },
        {
          "option": "",
          "shortcut": "--xml-strict-mode",
          "description": "enables strict parsing of XML. See https://pkg.go.dev/encoding/xml for more details."
        },
        {
          "option": "",
          "shortcut": "--yaml-fix-merge-anchor-to-spec",
          "description": "Fix merge anchor to match YAML spec.",
          "default": "true"
        }
      ],
      "aliases": [
        "completion",
        "shell-completion"
      ],
      "name": "yq completion",
      "raw_help_text": "To load completions:\n\nBash:\n\n$ source <(yq completion bash)\n\n# To load completions for each session, execute once:\nLinux:\n  $ yq completion bash > /etc/bash_completion.d/yq\nMacOS:\n  $ yq completion bash > /usr/local/etc/bash_completion.d/yq\n\nZsh:\n\n# If shell completion is not already enabled in your environment you will need\n# to enable it.  You can execute the following once:\n\n$ echo \"autoload -U compinit; compinit\" >> ~/.zshrc\n\n# To load completions for each session, execute once:\n$ yq completion zsh > \"${fpath[1]}/_yq\"\n\n# You will need to start a new shell for this setup to take effect.\n\nFish:\n\n$ yq completion fish | source\n\n# To load completions for each session, execute once:\n$ yq completion fish > ~/.config/fish/completions/yq.fish\n\nUsage:\n  yq completion [bash|zsh|fish|powershell]\n\nAliases:\n  completion, shell-completion\n\nFlags:\n  -h, --help   help for completion\n\nGlobal Flags:\n  -C, --colors                          force print with colors\n      --csv-auto-parse                  parse CSV YAML/JSON values (default true)\n      --csv-separator char              CSV Separator character (default ,)\n      --debug-node-info                 debug node info\n  -e, --exit-status                     set exit status if there are no matches or null or false is returned\n      --expression string               forcibly set the expression argument. Useful when yq argument detection thinks your expression is a file.\n      --from-file string                Load expression from specified file.\n  -f, --front-matter string             (extract|process) first input as yaml front-matter. Extract will pull out the yaml content, process will run the expression against the yaml content, leaving the remaining data intact\n      --header-preprocess               Slurp any header comments and separators before processing expression. (default true)\n  -I, --indent int                      sets indent level for output (default 2)\n  -i, --inplace                         update the file in place of first file given.\n  -p, --input-format string             [auto|a|yaml|y|json|j|props|p|csv|c|tsv|t|xml|x|base64|uri|toml|lua|l|ini|i] parse format for input. (default \"auto\")\n      --lua-globals                     output keys as top-level global variables\n      --lua-prefix string               prefix (default \"return \")\n      --lua-suffix string               suffix (default \";\\n\")\n      --lua-unquoted                    output unquoted string keys (e.g. {foo=\"bar\"})\n  -M, --no-colors                       force print with no colors\n  -N, --no-doc                          Don't print document separators (---)\n  -0, --nul-output                      Use NUL char to separate values. If unwrap scalar is also set, fail if unwrapped scalar contains NUL char.\n  -n, --null-input                      Don't read input, simply evaluate the expression given. Useful for creating docs from scratch.\n  -o, --output-format string            [auto|a|yaml|y|json|j|props|p|csv|c|tsv|t|xml|x|base64|uri|toml|shell|s|lua|l|ini|i] output format type. (default \"auto\")\n  -P, --prettyPrint                     pretty print, shorthand for '... style = \"\"'\n      --properties-array-brackets       use [x] in array paths (e.g. for SpringBoot)\n      --properties-separator string     separator to use between keys and values (default \" = \")\n      --security-disable-env-ops        Disable env related operations.\n      --security-disable-file-ops       Disable file related operations (e.g. load)\n      --shell-key-separator string      separator for shell variable key paths (default \"_\")\n  -s, --split-exp string                print each result (or doc) into a file named (exp). [exp] argument must return a string. You can use $index in the expression as the result counter. The necessary directories will be created.\n      --split-exp-file string           Use a file to specify the split-exp expression.\n      --string-interpolation            Toggles strings interpolation of \\(exp) (default true)\n      --tsv-auto-parse                  parse TSV YAML/JSON values (default true)\n  -r, --unwrapScalar                    unwrap scalar, print the value with no quotes, colors or comments. Defaults to true for yaml (default true)\n  -v, --verbose                         verbose mode\n      --xml-attribute-prefix string     prefix for xml attributes (default \"+@\")\n      --xml-content-name string         name for xml content (if no attribute name is present). (default \"+content\")\n      --xml-directive-name string       name for xml directives (e.g. <!DOCTYPE thing cat>) (default \"+directive\")\n      --xml-keep-namespace              enables keeping namespace after parsing attributes (default true)\n      --xml-proc-inst-prefix string     prefix for xml processing instructions (e.g. <?xml version=\"1\"?>) (default \"+p_\")\n      --xml-raw-token                   enables using RawToken method instead Token. Commonly disables namespace translations. See https://pkg.go.dev/encoding/xml#Decoder.RawToken for details. (default true)\n      --xml-skip-directives             skip over directives (e.g. <!DOCTYPE thing cat>)\n      --xml-skip-proc-inst              skip over process instructions (e.g. <?xml version=\"1\"?>)\n      --xml-strict-mode                 enables strict parsing of XML. See https://pkg.go.dev/encoding/xml for more details.\n      --yaml-fix-merge-anchor-to-spec   Fix merge anchor to match YAML spec. Will default to true in late 2025",
      "description": "Generate the autocompletion script for the specified shell"
    },
    {
      "subcommands": [],
      "options": [
        {
          "option": "-h",
          "shortcut": "--help",
          "description": "help for eval"
        },
        {
          "option": "-C",
          "shortcut": "--colors",
          "description": "force print with colors"
        },
        {
          "option": "--csv-auto-parse",
          "description": "parse CSV YAML/JSON values",
          "default": "true"
        },
        {
          "option": "--csv-separator",
          "description": "CSV Separator character",
          "default": ","
        },
        {
          "option": "--debug-node-info",
          "description": "debug node info"
        },
        {
          "option": "-e",
          "shortcut": "--exit-status",
          "description": "set exit status if there are no matches or null or false is returned"
        },
        {
          "option": "--expression",
          "description": "forcibly set the expression argument. Useful when yq argument detection thinks your expression is a file."
        },
        {
          "option": "--from-file",
          "description": "Load expression from specified file."
        },
        {
          "option": "-f",
          "shortcut": "--front-matter",
          "description": "(extract|process) first input as yaml front-matter. Extract will pull out the yaml content, process will run the expression against the yaml content, leaving the remaining data intact"
        },
        {
          "option": "--header-preprocess",
          "description": "Slurp any header comments and separators before processing expression.",
          "default": "true"
        },
        {
          "option": "-I",
          "shortcut": "--indent",
          "description": "sets indent level for output",
          "default": "2"
        },
        {
          "option": "-i",
          "shortcut": "--inplace",
          "description": "update the file in place of first file given."
        },
        {
          "option": "-p",
          "shortcut": "--input-format",
          "description": "[auto|a|yaml|y|json|j|props|p|csv|c|tsv|t|xml|x|base64|uri|toml|lua|l|ini|i] parse format for input.",
          "default": "auto"
        },
        {
          "option": "--lua-globals",
          "description": "output keys as top-level global variables"
        },
        {
          "option": "--lua-prefix",
          "description": "prefix",
          "default": "return "
        },
        {
          "option": "--lua-suffix",
          "description": "suffix",
          "default": ";\n"
        },
        {
          "option": "--lua-unquoted",
          "description": "output unquoted string keys (e.g. {foo=\"bar\"})"
        },
        {
          "option": "-M",
          "shortcut": "--no-colors",
          "description": "force print with no colors"
        },
        {
          "option": "-N",
          "shortcut": "--no-doc",
          "description": "Don't print document separators (---)"
        },
        {
          "option": "-0",
          "shortcut": "--nul-output",
          "description": "Use NUL char to separate values. If unwrap scalar is also set, fail if unwrapped scalar contains NUL char."
        },
        {
          "option": "-n",
          "shortcut": "--null-input",
          "description": "Don't read input, simply evaluate the expression given. Useful for creating docs from scratch."
        },
        {
          "option": "-o",
          "shortcut": "--output-format",
          "description": "[auto|a|yaml|y|json|j|props|p|csv|c|tsv|t|xml|x|base64|uri|toml|shell|s|lua|l|ini|i] output format type.",
          "default": "auto"
        },
        {
          "option": "-P",
          "shortcut": "--prettyPrint",
          "description": "pretty print, shorthand for '... style = \"\"'"
        },
        {
          "option": "--properties-array-brackets",
          "description": "use [x] in array paths (e.g. for SpringBoot)"
        },
        {
          "option": "--properties-separator",
          "description": "separator to use between keys and values",
          "default": " = "
        },
        {
          "option": "--security-disable-env-ops",
          "description": "Disable env related operations."
        },
        {
          "option": "--security-disable-file-ops",
          "description": "Disable file related operations (e.g. load)"
        },
        {
          "option": "--shell-key-separator",
          "description": "separator for shell variable key paths",
          "default": "_"
        },
        {
          "option": "-s",
          "shortcut": "--split-exp",
          "description": "print each result (or doc) into a file named (exp). [exp] argument must return a string. You can use $index in the expression as the result counter. The necessary directories will be created."
        },
        {
          "option": "--split-exp-file",
          "description": "Use a file to specify the split-exp expression."
        },
        {
          "option": "--string-interpolation",
          "description": "Toggles strings interpolation of \\(exp)",
          "default": "true"
        },
        {
          "option": "--tsv-auto-parse",
          "description": "parse TSV YAML/JSON values",
          "default": "true"
        },
        {
          "option": "-r",
          "shortcut": "--unwrapScalar",
          "description": "unwrap scalar, print the value with no quotes, colors or comments.",
          "default": "true"
        },
        {
          "option": "-v",
          "shortcut": "--verbose",
          "description": "verbose mode"
        },
        {
          "option": "--xml-attribute-prefix",
          "description": "prefix for xml attributes",
          "default": "+@"
        },
        {
          "option": "--xml-content-name",
          "description": "name for xml content (if no attribute name is present).",
          "default": "+content"
        },
        {
          "option": "--xml-directive-name",
          "description": "name for xml directives (e.g. <!DOCTYPE thing cat>)",
          "default": "+directive"
        },
        {
          "option": "--xml-keep-namespace",
          "description": "enables keeping namespace after parsing attributes",
          "default": "true"
        },
        {
          "option": "--xml-proc-inst-prefix",
          "description": "prefix for xml processing instructions (e.g. <?xml version=\"1\"?>)",
          "default": "+p_"
        },
        {
          "option": "--xml-raw-token",
          "description": "enables using RawToken method instead Token. Commonly disables namespace translations. See https://pkg.go.dev/encoding/xml#Decoder.RawToken for details.",
          "default": "true"
        },
        {
          "option": "--xml-skip-directives",
          "description": "skip over directives (e.g. <!DOCTYPE thing cat>)"
        },
        {
          "option": "--xml-skip-proc-inst",
          "description": "skip over process instructions (e.g. <?xml version=\"1\"?>)"
        },
        {
          "option": "--xml-strict-mode",
          "description": "enables strict parsing of XML. See https://pkg.go.dev/encoding/xml for more details."
        },
        {
          "option": "--yaml-fix-merge-anchor-to-spec",
          "description": "Fix merge anchor to match YAML spec.",
          "default": "true"
        }
      ],
      "aliases": [
        "eval",
        "e"
      ],
      "name": "yq eval",
      "raw_help_text": "yq is a portable command-line data file processor (https://github.com/mikefarah/yq/) \nSee https://mikefarah.gitbook.io/yq/ for detailed documentation and examples.\n\n## Evaluate Sequence ##\nThis command iterates over each yaml document from each given file, applies the \nexpression and prints the result in sequence.\n\nUsage:\n  yq eval [expression] [yaml_file1]... [flags]\n\nAliases:\n  eval, e\n\nExamples:\n\n# Reads field under the given path for each file\nyq e '.a.b' f1.yml f2.yml \n\n# Prints out the file\nyq e sample.yaml \n\n# Pipe from STDIN\n## use '-' as a filename to pipe from STDIN\ncat file2.yml | yq e '.a.b' file1.yml - file3.yml\n\n# Creates a new yaml document\n## Note that editing an empty file does not work.\nyq e -n '.a.b.c = \"cat\"' \n\n# Update a file in place\nyq e '.a.b = \"cool\"' -i file.yaml \n\n\nFlags:\n  -h, --help   help for eval\n\nGlobal Flags:\n  -C, --colors                          force print with colors\n      --csv-auto-parse                  parse CSV YAML/JSON values (default true)\n      --csv-separator char              CSV Separator character (default ,)\n      --debug-node-info                 debug node info\n  -e, --exit-status                     set exit status if there are no matches or null or false is returned\n      --expression string               forcibly set the expression argument. Useful when yq argument detection thinks your expression is a file.\n      --from-file string                Load expression from specified file.\n  -f, --front-matter string             (extract|process) first input as yaml front-matter. Extract will pull out the yaml content, process will run the expression against the yaml content, leaving the remaining data intact\n      --header-preprocess               Slurp any header comments and separators before processing expression. (default true)\n  -I, --indent int                      sets indent level for output (default 2)\n  -i, --inplace                         update the file in place of first file given.\n  -p, --input-format string             [auto|a|yaml|y|json|j|props|p|csv|c|tsv|t|xml|x|base64|uri|toml|lua|l|ini|i] parse format for input. (default \"auto\")\n      --lua-globals                     output keys as top-level global variables\n      --lua-prefix string               prefix (default \"return \")\n      --lua-suffix string               suffix (default \";\\n\")\n      --lua-unquoted                    output unquoted string keys (e.g. {foo=\"bar\"})\n  -M, --no-colors                       force print with no colors\n  -N, --no-doc                          Don't print document separators (---)\n  -0, --nul-output                      Use NUL char to separate values. If unwrap scalar is also set, fail if unwrapped scalar contains NUL char.\n  -n, --null-input                      Don't read input, simply evaluate the expression given. Useful for creating docs from scratch.\n  -o, --output-format string            [auto|a|yaml|y|json|j|props|p|csv|c|tsv|t|xml|x|base64|uri|toml|shell|s|lua|l|ini|i] output format type. (default \"auto\")\n  -P, --prettyPrint                     pretty print, shorthand for '... style = \"\"'\n      --properties-array-brackets       use [x] in array paths (e.g. for SpringBoot)\n      --properties-separator string     separator to use between keys and values (default \" = \")\n      --security-disable-env-ops        Disable env related operations.\n      --security-disable-file-ops       Disable file related operations (e.g. load)\n      --shell-key-separator string      separator for shell variable key paths (default \"_\")\n  -s, --split-exp string                print each result (or doc) into a file named (exp). [exp] argument must return a string. You can use $index in the expression as the result counter. The necessary directories will be created.\n      --split-exp-file string           Use a file to specify the split-exp expression.\n      --string-interpolation            Toggles strings interpolation of \\(exp) (default true)\n      --tsv-auto-parse                  parse TSV YAML/JSON values (default true)\n  -r, --unwrapScalar                    unwrap scalar, print the value with no quotes, colors or comments. Defaults to true for yaml (default true)\n  -v, --verbose                         verbose mode\n      --xml-attribute-prefix string     prefix for xml attributes (default \"+@\")\n      --xml-content-name string         name for xml content (if no attribute name is present). (default \"+content\")\n      --xml-directive-name string       name for xml directives (e.g. <!DOCTYPE thing cat>) (default \"+directive\")\n      --xml-keep-namespace              enables keeping namespace after parsing attributes (default true)\n      --xml-proc-inst-prefix string     prefix for xml processing instructions (e.g. <?xml version=\"1\"?>) (default \"+p_\")\n      --xml-raw-token                   enables using RawToken method instead Token. Commonly disables namespace translations. See https://pkg.go.dev/encoding/xml#Decoder.RawToken for details. (default true)\n      --xml-skip-directives             skip over directives (e.g. <!DOCTYPE thing cat>)\n      --xml-skip-proc-inst              skip over process instructions (e.g. <?xml version=\"1\"?>)\n      --xml-strict-mode                 enables strict parsing of XML. See https://pkg.go.dev/encoding/xml for more details.\n      --yaml-fix-merge-anchor-to-spec   Fix merge anchor to match YAML spec. Will default to true in late 2025",
      "description": "(default) Apply the expression to each document in each yaml file in sequence"
    },
    {
      "subcommands": [],
      "options": [
        {
          "option": "--help",
          "shortcut": "-h",
          "description": "help for eval-all"
        },
        {
          "option": "--colors",
          "shortcut": "-C",
          "description": "force print with colors"
        },
        {
          "option": "--csv-auto-parse",
          "description": "parse CSV YAML/JSON values (default true)"
        },
        {
          "option": "--csv-separator",
          "description": "CSV Separator character (default ,)",
          "value": "char"
        },
        {
          "option": "--debug-node-info",
          "description": "debug node info"
        },
        {
          "option": "--exit-status",
          "shortcut": "-e",
          "description": "set exit status if there are no matches or null or false is returned"
        },
        {
          "option": "--expression",
          "description": "forcibly set the expression argument. Useful when yq argument detection thinks your expression is a file.",
          "value": "string"
        },
        {
          "option": "--from-file",
          "description": "Load expression from specified file.",
          "value": "string"
        },
        {
          "option": "--front-matter",
          "shortcut": "-f",
          "description": "(extract|process) first input as yaml front-matter. Extract will pull out the yaml content, process will run the expression against the yaml content, leaving the remaining data intact",
          "value": "string"
        },
        {
          "option": "--header-preprocess",
          "description": "Slurp any header comments and separators before processing expression. (default true)"
        },
        {
          "option": "--indent",
          "shortcut": "-I",
          "description": "sets indent level for output (default 2)",
          "value": "int"
        },
        {
          "option": "--inplace",
          "shortcut": "-i",
          "description": "update the file in place of first file given."
        },
        {
          "option": "--input-format",
          "shortcut": "-p",
          "description": "[auto|a|yaml|y|json|j|props|p|csv|c|tsv|t|xml|x|base64|uri|toml|lua|l|ini|i] parse format for input. (default \"auto\")",
          "value": "string"
        },
        {
          "option": "--lua-globals",
          "description": "output keys as top-level global variables"
        },
        {
          "option": "--lua-prefix",
          "description": "prefix (default \"return \")",
          "value": "string"
        },
        {
          "option": "--lua-suffix",
          "description": "suffix (default \";\n\")",
          "value": "string"
        },
        {
          "option": "--lua-unquoted",
          "description": "output unquoted string keys (e.g. {foo=\"bar\"})"
        },
        {
          "option": "--no-colors",
          "shortcut": "-M",
          "description": "force print with no colors"
        },
        {
          "option": "--no-doc",
          "shortcut": "-N",
          "description": "Don't print document separators (---)"
        },
        {
          "option": "--nul-output",
          "shortcut": "-0",
          "description": "Use NUL char to separate values. If unwrap scalar is also set, fail if unwrapped scalar contains NUL char."
        },
        {
          "option": "--null-input",
          "shortcut": "-n",
          "description": "Don't read input, simply evaluate the expression given. Useful for creating docs from scratch."
        },
        {
          "option": "--output-format",
          "shortcut": "-o",
          "description": "[auto|a|yaml|y|json|j|props|p|csv|c|tsv|t|xml|x|base64|uri|toml|shell|s|lua|l|ini|i] output format type. (default \"auto\")",
          "value": "string"
        },
        {
          "option": "--prettyPrint",
          "shortcut": "-P",
          "description": "pretty print, shorthand for '... style = \"\"'"
        },
        {
          "option": "--properties-array-brackets",
          "description": "use [x] in array paths (e.g. for SpringBoot)"
        },
        {
          "option": "--properties-separator",
          "description": "separator to use between keys and values (default \" = \")",
          "value": "string"
        },
        {
          "option": "--security-disable-env-ops",
          "description": "Disable env related operations."
        },
        {
          "option": "--security-disable-file-ops",
          "description": "Disable file related operations (e.g. load)"
        },
        {
          "option": "--shell-key-separator",
          "description": "separator for shell variable key paths (default \"_\")",
          "value": "string"
        },
        {
          "option": "--split-exp",
          "shortcut": "-s",
          "description": "print each result (or doc) into a file named (exp). [exp] argument must return a string. You can use $index in the expression as the result counter. The necessary directories will be created.",
          "value": "string"
        },
        {
          "option": "--split-exp-file",
          "description": "Use a file to specify the split-exp expression.",
          "value": "string"
        },
        {
          "option": "--string-interpolation",
          "description": "Toggles strings interpolation of \\(exp) (default true)"
        },
        {
          "option": "--tsv-auto-parse",
          "description": "parse TSV YAML/JSON values (default true)"
        },
        {
          "option": "--unwrapScalar",
          "shortcut": "-r",
          "description": "unwrap scalar, print the value with no quotes, colors or comments. Defaults to true for yaml (default true)"
        },
        {
          "option": "--verbose",
          "shortcut": "-v",
          "description": "verbose mode"
        },
        {
          "option": "--xml-attribute-prefix",
          "description": "prefix for xml attributes (default \"+@\")",
          "value": "string"
        },
        {
          "option": "--xml-content-name",
          "description": "name for xml content (if no attribute name is present). (default \"+content\")",
          "value": "string"
        },
        {
          "option": "--xml-directive-name",
          "description": "name for xml directives (e.g. <!DOCTYPE thing cat>) (default \"+directive\")",
          "value": "string"
        },
        {
          "option": "--xml-keep-namespace",
          "description": "enables keeping namespace after parsing attributes (default true)"
        },
        {
          "option": "--xml-proc-inst-prefix",
          "description": "prefix for xml processing instructions (e.g. <?xml version=\"1\"?>) (default \"+p_\")",
          "value": "string"
        },
        {
          "option": "--xml-raw-token",
          "description": "enables using RawToken method instead Token. Commonly disables namespace translations. See https://pkg.go.dev/encoding/xml#Decoder.RawToken for details. (default true)"
        },
        {
          "option": "--xml-skip-directives",
          "description": "skip over directives (e.g. <!DOCTYPE thing cat>)"
        },
        {
          "option": "--xml-skip-proc-inst",
          "description": "skip over process instructions (e.g. <?xml version=\"1\"?>)"
        },
        {
          "option": "--xml-strict-mode",
          "description": "enables strict parsing of XML. See https://pkg.go.dev/encoding/xml for more details."
        },
        {
          "option": "--yaml-fix-merge-anchor-to-spec",
          "description": "Fix merge anchor to match YAML spec. Will default to true in late 2025"
        }
      ],
      "aliases": [
        "eval-all",
        "ea"
      ],
      "name": "yq eval-all",
      "raw_help_text": "yq is a portable command-line data file processor (https://github.com/mikefarah/yq/) \nSee https://mikefarah.gitbook.io/yq/ for detailed documentation and examples.\n\n## Evaluate All ##\nThis command loads _all_ yaml documents of _all_ yaml files and runs expression once\nUseful when you need to run an expression across several yaml documents or files (like merge).\nNote that it consumes more memory than eval.\n\nUsage:\n  yq eval-all [expression] [yaml_file1]... [flags]\n\nAliases:\n  eval-all, ea\n\nExamples:\n\n# Merge f2.yml into f1.yml (in place)\nyq eval-all --inplace 'select(fileIndex == 0) * select(fileIndex == 1)' f1.yml f2.yml\n## the same command and expression using shortened names:\nyq ea -i 'select(fi == 0) * select(fi == 1)' f1.yml f2.yml\n\n\n# Merge all given files\nyq ea '. as $item ireduce ({}; . * $item )' file1.yml file2.yml ...\n\n# Pipe from STDIN\n## use '-' as a filename to pipe from STDIN\ncat file2.yml | yq ea '.a.b' file1.yml - file3.yml\n\n\nFlags:\n  -h, --help   help for eval-all\n\nGlobal Flags:\n  -C, --colors                          force print with colors\n      --csv-auto-parse                  parse CSV YAML/JSON values (default true)\n      --csv-separator char              CSV Separator character (default ,)\n      --debug-node-info                 debug node info\n  -e, --exit-status                     set exit status if there are no matches or null or false is returned\n      --expression string               forcibly set the expression argument. Useful when yq argument detection thinks your expression is a file.\n      --from-file string                Load expression from specified file.\n  -f, --front-matter string             (extract|process) first input as yaml front-matter. Extract will pull out the yaml content, process will run the expression against the yaml content, leaving the remaining data intact\n      --header-preprocess               Slurp any header comments and separators before processing expression. (default true)\n  -I, --indent int                      sets indent level for output (default 2)\n  -i, --inplace                         update the file in place of first file given.\n  -p, --input-format string             [auto|a|yaml|y|json|j|props|p|csv|c|tsv|t|xml|x|base64|uri|toml|lua|l|ini|i] parse format for input. (default \"auto\")\n      --lua-globals                     output keys as top-level global variables\n      --lua-prefix string               prefix (default \"return \")\n      --lua-suffix string               suffix (default \";\\n\")\n      --lua-unquoted                    output unquoted string keys (e.g. {foo=\"bar\"})\n  -M, --no-colors                       force print with no colors\n  -N, --no-doc                          Don't print document separators (---)\n  -0, --nul-output                      Use NUL char to separate values. If unwrap scalar is also set, fail if unwrapped scalar contains NUL char.\n  -n, --null-input                      Don't read input, simply evaluate the expression given. Useful for creating docs from scratch.\n  -o, --output-format string            [auto|a|yaml|y|json|j|props|p|csv|c|tsv|t|xml|x|base64|uri|toml|shell|s|lua|l|ini|i] output format type. (default \"auto\")\n  -P, --prettyPrint                     pretty print, shorthand for '... style = \"\"'\n      --properties-array-brackets       use [x] in array paths (e.g. for SpringBoot)\n      --properties-separator string     separator to use between keys and values (default \" = \")\n      --security-disable-env-ops        Disable env related operations.\n      --security-disable-file-ops       Disable file related operations (e.g. load)\n      --shell-key-separator string      separator for shell variable key paths (default \"_\")\n  -s, --split-exp string                print each result (or doc) into a file named (exp). [exp] argument must return a string. You can use $index in the expression as the result counter. The necessary directories will be created.\n      --split-exp-file string           Use a file to specify the split-exp expression.\n      --string-interpolation            Toggles strings interpolation of \\(exp) (default true)\n      --tsv-auto-parse                  parse TSV YAML/JSON values (default true)\n  -r, --unwrapScalar                    unwrap scalar, print the value with no quotes, colors or comments. Defaults to true for yaml (default true)\n  -v, --verbose                         verbose mode\n      --xml-attribute-prefix string     prefix for xml attributes (default \"+@\")\n      --xml-content-name string         name for xml content (if no attribute name is present). (default \"+content\")\n      --xml-directive-name string       name for xml directives (e.g. <!DOCTYPE thing cat>) (default \"+directive\")\n      --xml-keep-namespace              enables keeping namespace after parsing attributes (default true)\n      --xml-proc-inst-prefix string     prefix for xml processing instructions (e.g. <?xml version=\"1\"?>) (default \"+p_\")\n      --xml-raw-token                   enables using RawToken method instead Token. Commonly disables namespace translations. See https://pkg.go.dev/encoding/xml#Decoder.RawToken for details. (default true)\n      --xml-skip-directives             skip over directives (e.g. <!DOCTYPE thing cat>)\n      --xml-skip-proc-inst              skip over process instructions (e.g. <?xml version=\"1\"?>)\n      --xml-strict-mode                 enables strict parsing of XML. See https://pkg.go.dev/encoding/xml for more details.\n      --yaml-fix-merge-anchor-to-spec   Fix merge anchor to match YAML spec. Will default to true in late 2025",
      "description": "Loads _all_ yaml documents of _all_ yaml files and runs expression once"
    }
  ],
  "options": [
    {
      "option": "-C",
      "shortcut": "--colors",
      "description": "force print with colors"
    },
    {
      "option": "--csv-auto-parse",
      "description": "parse CSV YAML/JSON values (default true)"
    },
    {
      "option": "--csv-separator",
      "description": "CSV Separator character (default ,)",
      "value": "char"
    },
    {
      "option": "--debug-node-info",
      "description": "debug node info"
    },
    {
      "option": "-e",
      "shortcut": "--exit-status",
      "description": "set exit status if there are no matches or null or false is returned"
    },
    {
      "option": "--expression",
      "description": "forcibly set the expression argument. Useful when yq argument detection thinks your expression is a file.",
      "value": "string"
    },
    {
      "option": "--from-file",
      "description": "Load expression from specified file.",
      "value": "string"
    },
    {
      "option": "-f",
      "shortcut": "--front-matter",
      "description": "(extract|process) first input as yaml front-matter. Extract will pull out the yaml content, process will run the expression against the yaml content, leaving the remaining data intact",
      "value": "string"
    },
    {
      "option": "--header-preprocess",
      "description": "Slurp any header comments and separators before processing expression. (default true)"
    },
    {
      "option": "-h",
      "shortcut": "--help",
      "description": "help for yq"
    },
    {
      "option": "-I",
      "shortcut": "--indent",
      "description": "sets indent level for output (default 2)",
      "value": "int"
    },
    {
      "option": "-i",
      "shortcut": "--inplace",
      "description": "update the file in place of first file given."
    },
    {
      "option": "-p",
      "shortcut": "--input-format",
      "description": "[auto|a|yaml|y|json|j|props|p|csv|c|tsv|t|xml|x|base64|uri|toml|lua|l|ini|i] parse format for input. (default \"auto\")",
      "value": "string"
    },
    {
      "option": "--lua-globals",
      "description": "output keys as top-level global variables"
    },
    {
      "option": "--lua-prefix",
      "description": "prefix (default \"return \")",
      "value": "string"
    },
    {
      "option": "--lua-suffix",
      "description": "suffix (default \";\n\")",
      "value": "string"
    },
    {
      "option": "--lua-unquoted",
      "description": "output unquoted string keys (e.g. {foo=\"bar\"})"
    },
    {
      "option": "-M",
      "shortcut": "--no-colors",
      "description": "force print with no colors"
    },
    {
      "option": "-N",
      "shortcut": "--no-doc",
      "description": "Don't print document separators (---)"
    },
    {
      "option": "-0",
      "shortcut": "--nul-output",
      "description": "Use NUL char to separate values. If unwrap scalar is also set, fail if unwrapped scalar contains NUL char."
    },
    {
      "option": "-n",
      "shortcut": "--null-input",
      "description": "Don't read input, simply evaluate the expression given. Useful for creating docs from scratch."
    },
    {
      "option": "-o",
      "shortcut": "--output-format",
      "description": "[auto|a|yaml|y|json|j|props|p|csv|c|tsv|t|xml|x|base64|uri|toml|shell|s|lua|l|ini|i] output format type. (default \"auto\")",
      "value": "string"
    },
    {
      "option": "-P",
      "shortcut": "--prettyPrint",
      "description": "pretty print, shorthand for '... style = \"\"'"
    },
    {
      "option": "--properties-array-brackets",
      "description": "use [x] in array paths (e.g. for SpringBoot)"
    },
    {
      "option": "--properties-separator",
      "description": "separator to use between keys and values (default \" = \")",
      "value": "string"
    },
    {
      "option": "--security-disable-env-ops",
      "description": "Disable env related operations."
    },
    {
      "option": "--security-disable-file-ops",
      "description": "Disable file related operations (e.g. load)"
    },
    {
      "option": "-s",
      "shortcut": "--split-exp",
      "description": "print each result (or doc) into a file named (exp). [exp] argument must return a string. You can use $index in the expression as the result counter. The necessary directories will be created.",
      "value": "string"
    },
    {
      "option": "--split-exp-file",
      "description": "Use a file to specify the split-exp expression.",
      "value": "string"
    },
    {
      "option": "--string-interpolation",
      "description": "Toggles strings interpolation of \\(exp) (default true)"
    },
    {
      "option": "--tsv-auto-parse",
      "description": "parse TSV YAML/JSON values (default true)"
    },
    {
      "option": "-r",
      "shortcut": "--unwrapScalar",
      "description": "unwrap scalar, print the value with no quotes, colors or comments. Defaults to true for yaml (default true)"
    },
    {
      "option": "-v",
      "shortcut": "--verbose",
      "description": "verbose mode"
    },
    {
      "option": "-V",
      "shortcut": "--version",
      "description": "Print version information and quit"
    },
    {
      "option": "--xml-attribute-prefix",
      "description": "prefix for xml attributes (default \"+@\")",
      "value": "string"
    },
    {
      "option": "--xml-content-name",
      "description": "name for xml content (if no attribute name is present). (default \"+content\")",
      "value": "string"
    },
    {
      "option": "--xml-directive-name",
      "description": "name for xml directives (e.g. <!DOCTYPE thing cat>) (default \"+directive\")",
      "value": "string"
    },
    {
      "option": "--xml-keep-namespace",
      "description": "enables keeping namespace after parsing attributes (default true)"
    },
    {
      "option": "--xml-proc-inst-prefix",
      "description": "prefix for xml processing instructions (e.g. <?xml version=\"1\"?>) (default \"+p_\")",
      "value": "string"
    },
    {
      "option": "--xml-raw-token",
      "description": "enables using RawToken method instead Token. Commonly disables namespace translations. See https://pkg.go.dev/encoding/xml#Decoder.RawToken for details. (default true)"
    },
    {
      "option": "--xml-skip-directives",
      "description": "skip over directives (e.g. <!DOCTYPE thing cat>)"
    },
    {
      "option": "--xml-skip-proc-inst",
      "description": "skip over process instructions (e.g. <?xml version=\"1\"?>)"
    },
    {
      "option": "--xml-strict-mode",
      "description": "enables strict parsing of XML. See https://pkg.go.dev/encoding/xml for more details."
    },
    {
      "option": "--yaml-fix-merge-anchor-to-spec",
      "description": "Fix merge anchor to match YAML spec. Will default to true in late 2025"
    }
  ],
  "aliases": [],
  "name": "yq",
  "raw_help_text": "yq is a portable command-line data file processor (https://github.com/mikefarah/yq/) \nSee https://mikefarah.gitbook.io/yq/ for detailed documentation and examples.\n\nUsage:\n  yq [flags]\n  yq [command]\n\nExamples:\n\n# yq tries to auto-detect the file format based off the extension, and defaults to YAML if it's unknown (or piping through STDIN)\n# Use the '-p/--input-format' flag to specify a format type.\ncat file.xml | yq -p xml\n\n# read the \"stuff\" node from \"myfile.yml\"\nyq '.stuff' < myfile.yml\n\n# update myfile.yml in place\nyq -i '.stuff = \"foo\"' myfile.yml\n\n# print contents of sample.json as idiomatic YAML\nyq -P -oy sample.json\n\n\nAvailable Commands:\n  completion  Generate the autocompletion script for the specified shell\n  eval        (default) Apply the expression to each document in each yaml file in sequence\n  eval-all    Loads _all_ yaml documents of _all_ yaml files and runs expression once\n  help        Help about any command\n\nFlags:\n  -C, --colors                          force print with colors\n      --csv-auto-parse                  parse CSV YAML/JSON values (default true)\n      --csv-separator char              CSV Separator character (default ,)\n      --debug-node-info                 debug node info\n  -e, --exit-status                     set exit status if there are no matches or null or false is returned\n      --expression string               forcibly set the expression argument. Useful when yq argument detection thinks your expression is a file.\n      --from-file string                Load expression from specified file.\n  -f, --front-matter string             (extract|process) first input as yaml front-matter. Extract will pull out the yaml content, process will run the expression against the yaml content, leaving the remaining data intact\n      --header-preprocess               Slurp any header comments and separators before processing expression. (default true)\n  -h, --help                            help for yq\n  -I, --indent int                      sets indent level for output (default 2)\n  -i, --inplace                         update the file in place of first file given.\n  -p, --input-format string             [auto|a|yaml|y|json|j|props|p|csv|c|tsv|t|xml|x|base64|uri|toml|lua|l|ini|i] parse format for input. (default \"auto\")\n      --lua-globals                     output keys as top-level global variables\n      --lua-prefix string               prefix (default \"return \")\n      --lua-suffix string               suffix (default \";\\n\")\n      --lua-unquoted                    output unquoted string keys (e.g. {foo=\"bar\"})\n  -M, --no-colors                       force print with no colors\n  -N, --no-doc                          Don't print document separators (---)\n  -0, --nul-output                      Use NUL char to separate values. If unwrap scalar is also set, fail if unwrapped scalar contains NUL char.\n  -n, --null-input                      Don't read input, simply evaluate the expression given. Useful for creating docs from scratch.\n  -o, --output-format string            [auto|a|yaml|y|json|j|props|p|csv|c|tsv|t|xml|x|base64|uri|toml|shell|s|lua|l|ini|i] output format type. (default \"auto\")\n  -P, --prettyPrint                     pretty print, shorthand for '... style = \"\"'\n      --properties-array-brackets       use [x] in array paths (e.g. for SpringBoot)\n      --properties-separator string     separator to use between keys and values (default \" = \")\n      --security-disable-env-ops        Disable env related operations.\n      --security-disable-file-ops       Disable file related operations (e.g. load)\n      --shell-key-separator string      separator for shell variable key paths (default \"_\")\n  -s, --split-exp string                print each result (or doc) into a file named (exp). [exp] argument must return a string. You can use $index in the expression as the result counter. The necessary directories will be created.\n      --split-exp-file string           Use a file to specify the split-exp expression.\n      --string-interpolation            Toggles strings interpolation of \\(exp) (default true)\n      --tsv-auto-parse                  parse TSV YAML/JSON values (default true)\n  -r, --unwrapScalar                    unwrap scalar, print the value with no quotes, colors or comments. Defaults to true for yaml (default true)\n  -v, --verbose                         verbose mode\n  -V, --version                         Print version information and quit\n      --xml-attribute-prefix string     prefix for xml attributes (default \"+@\")\n      --xml-content-name string         name for xml content (if no attribute name is present). (default \"+content\")\n      --xml-directive-name string       name for xml directives (e.g. <!DOCTYPE thing cat>) (default \"+directive\")\n      --xml-keep-namespace              enables keeping namespace after parsing attributes (default true)\n      --xml-proc-inst-prefix string     prefix for xml processing instructions (e.g. <?xml version=\"1\"?>) (default \"+p_\")\n      --xml-raw-token                   enables using RawToken method instead Token. Commonly disables namespace translations. See https://pkg.go.dev/encoding/xml#Decoder.RawToken for details. (default true)\n      --xml-skip-directives             skip over directives (e.g. <!DOCTYPE thing cat>)\n      --xml-skip-proc-inst              skip over process instructions (e.g. <?xml version=\"1\"?>)\n      --xml-strict-mode                 enables strict parsing of XML. See https://pkg.go.dev/encoding/xml for more details.\n      --yaml-fix-merge-anchor-to-spec   Fix merge anchor to match YAML spec. Will default to true in late 2025\n\nUse \"yq [command] --help\" for more information about a command.",
  "version": "v4.49.2"
}