{
  "subcommands": [],
  "options": [
    {
      "option": "-d",
      "shortcut": "-domain",
      "description": "domains to find subdomains for",
      "value": "string[]",
      "default": null
    },
    {
      "option": "-dL",
      "shortcut": "-list",
      "description": "file containing list of domains for subdomain discovery",
      "value": "string",
      "default": null
    },
    {
      "option": "-s",
      "shortcut": "-sources",
      "description": "specific sources to use for discovery (-s crtsh,github). Use -ls to display all available sources.",
      "value": "string[]",
      "default": null
    },
    {
      "option": "-recursive",
      "shortcut": null,
      "description": "use only sources that can handle subdomains recursively rather than both recursive and non-recursive sources",
      "value": null,
      "default": null
    },
    {
      "option": "-all",
      "shortcut": null,
      "description": "use all sources for enumeration (slow)",
      "value": null,
      "default": null
    },
    {
      "option": "-es",
      "shortcut": "-exclude-sources",
      "description": "sources to exclude from enumeration (-es alienvault,zoomeyeapi)",
      "value": "string[]",
      "default": null
    },
    {
      "option": "-m",
      "shortcut": "-match",
      "description": "subdomain or list of subdomain to match (file or comma separated)",
      "value": "string[]",
      "default": null
    },
    {
      "option": "-f",
      "shortcut": "-filter",
      "description": "subdomain or list of subdomain to filter (file or comma separated)",
      "value": "string[]",
      "default": null
    },
    {
      "option": "-rl",
      "shortcut": "-rate-limit",
      "description": "maximum number of http requests to send per second (global)",
      "value": "int",
      "default": null
    },
    {
      "option": "-rls",
      "shortcut": "-rate-limits",
      "description": "maximum number of http requests to send per second for providers in key=value format (-rls hackertarget=10/m)",
      "value": "value",
      "default": "[\"github=30/m\", \"fullhunt=60/m\", \"robtex=18446744073709551615/ms\", \"securitytrails=1/s\", \"shodan=1/s\", \"virustotal=4/m\", \"hackertarget=2/s\", \"waybackarchive=15/m\", \"whoisxmlapi=50/s\", \"securitytrails=2/s\", \"sitedossier=8/m\", \"netlas=1/s\", \"github=83/m\", \"hudsonrock=5/s\"]"
    },
    {
      "option": "-t",
      "shortcut": null,
      "description": "number of concurrent goroutines for resolving (-active only)",
      "value": "int",
      "default": "10"
    },
    {
      "option": "-up",
      "shortcut": "-update",
      "description": "update subfinder to latest version",
      "value": null,
      "default": null
    },
    {
      "option": "-duc",
      "shortcut": "-disable-update-check",
      "description": "disable automatic subfinder update check",
      "value": null,
      "default": null
    },
    {
      "option": "-o",
      "shortcut": "-output",
      "description": "file to write output to",
      "value": "string",
      "default": null
    },
    {
      "option": "-oJ",
      "shortcut": "-json",
      "description": "write output in JSONL(ines) format",
      "value": null,
      "default": null
    },
    {
      "option": "-oD",
      "shortcut": "-output-dir",
      "description": "directory to write output (-dL only)",
      "value": "string",
      "default": null
    },
    {
      "option": "-cs",
      "shortcut": "-collect-sources",
      "description": "include all sources in the output (-json only)",
      "value": null,
      "default": null
    },
    {
      "option": "-oI",
      "shortcut": "-ip",
      "description": "include host IP in output (-active only)",
      "value": null,
      "default": null
    },
    {
      "option": "-config",
      "shortcut": null,
      "description": "flag config file",
      "value": "string",
      "default": "\"/root/.config/subfinder/config.yaml\""
    },
    {
      "option": "-pc",
      "shortcut": "-provider-config",
      "description": "provider config file",
      "value": "string",
      "default": "\"/root/.config/subfinder/provider-config.yaml\""
    },
    {
      "option": "-r",
      "shortcut": null,
      "description": "comma separated list of resolvers to use",
      "value": "string[]",
      "default": null
    },
    {
      "option": "-rL",
      "shortcut": "-rlist",
      "description": "file containing list of resolvers to use",
      "value": "string",
      "default": null
    },
    {
      "option": "-nW",
      "shortcut": "-active",
      "description": "display active subdomains only",
      "value": null,
      "default": null
    },
    {
      "option": "-proxy",
      "shortcut": null,
      "description": "http proxy to use with subfinder",
      "value": "string",
      "default": null
    },
    {
      "option": "-ei",
      "shortcut": "-exclude-ip",
      "description": "exclude IPs from the list of domains",
      "value": null,
      "default": null
    },
    {
      "option": "-silent",
      "shortcut": null,
      "description": "show only subdomains in output",
      "value": null,
      "default": null
    },
    {
      "option": "-version",
      "shortcut": null,
      "description": "show version of subfinder",
      "value": null,
      "default": null
    },
    {
      "option": "-v",
      "shortcut": null,
      "description": "show verbose output",
      "value": null,
      "default": null
    },
    {
      "option": "-nc",
      "shortcut": "-no-color",
      "description": "disable color in output",
      "value": null,
      "default": null
    },
    {
      "option": "-ls",
      "shortcut": "-list-sources",
      "description": "list all available sources",
      "value": null,
      "default": null
    },
    {
      "option": "-stats",
      "shortcut": null,
      "description": "report source statistics",
      "value": null,
      "default": null
    },
    {
      "option": "-timeout",
      "shortcut": null,
      "description": "seconds to wait before timing out",
      "value": "int",
      "default": "30"
    },
    {
      "option": "-max-time",
      "shortcut": null,
      "description": "minutes to wait for enumeration results",
      "value": "int",
      "default": "10"
    }
  ],
  "aliases": [],
  "name": "subfinder",
  "raw_help_text": "Subfinder is a subdomain discovery tool that discovers subdomains for websites by using passive online sources.\n\nUsage:\n  /usr/local/bin/subfinder [flags]\n\nFlags:\nINPUT:\n   -d, -domain string[]  domains to find subdomains for\n   -dL, -list string     file containing list of domains for subdomain discovery\n\nSOURCE:\n   -s, -sources string[]           specific sources to use for discovery (-s crtsh,github). Use -ls to display all available sources.\n   -recursive                      use only sources that can handle subdomains recursively rather than both recursive and non-recursive sources\n   -all                            use all sources for enumeration (slow)\n   -es, -exclude-sources string[]  sources to exclude from enumeration (-es alienvault,zoomeyeapi)\n\nFILTER:\n   -m, -match string[]   subdomain or list of subdomain to match (file or comma separated)\n   -f, -filter string[]   subdomain or list of subdomain to filter (file or comma separated)\n\nRATE-LIMIT:\n   -rl, -rate-limit int      maximum number of http requests to send per second (global)\n   -rls, -rate-limits value  maximum number of http requests to send per second for providers in key=value format (-rls hackertarget=10/m) (default [\"github=30/m\", \"fullhunt=60/m\", \"robtex=18446744073709551615/ms\", \"securitytrails=1/s\", \"shodan=1/s\", \"virustotal=4/m\", \"hackertarget=2/s\", \"waybackarchive=15/m\", \"whoisxmlapi=50/s\", \"securitytrails=2/s\", \"sitedossier=8/m\", \"netlas=1/s\", \"github=83/m\", \"hudsonrock=5/s\"])\n   -t int                    number of concurrent goroutines for resolving (-active only) (default 10)\n\nUPDATE:\n   -up, -update                 update subfinder to latest version\n   -duc, -disable-update-check  disable automatic subfinder update check\n\nOUTPUT:\n   -o, -output string       file to write output to\n   -oJ, -json               write output in JSONL(ines) format\n   -oD, -output-dir string  directory to write output (-dL only)\n   -cs, -collect-sources    include all sources in the output (-json only)\n   -oI, -ip                 include host IP in output (-active only)\n\nCONFIGURATION:\n   -config string                flag config file (default \"/root/.config/subfinder/config.yaml\")\n   -pc, -provider-config string  provider config file (default \"/root/.config/subfinder/provider-config.yaml\")\n   -r string[]                   comma separated list of resolvers to use\n   -rL, -rlist string            file containing list of resolvers to use\n   -nW, -active                  display active subdomains only\n   -proxy string                 http proxy to use with subfinder\n   -ei, -exclude-ip              exclude IPs from the list of domains\n\nDEBUG:\n   -silent             show only subdomains in output\n   -version            show version of subfinder\n   -v                  show verbose output\n   -nc, -no-color      disable color in output\n   -ls, -list-sources  list all available sources\n   -stats              report source statistics\n\nOPTIMIZATION:\n   -timeout int   seconds to wait before timing out (default 30)\n   -max-time int  minutes to wait for enumeration results (default 10)",
  "version": "v2.7.0"
}