{
  "name": "tfsec",
  "version": "v1.26.3",
  "subcommands": [],
  "options": [
    {
      "option": "--code-theme",
      "shortcut": null,
      "description": "Theme for annotated code. Either 'light' or 'dark'.",
      "value": "string",
      "default": "dark"
    },
    {
      "option": "--concise-output",
      "shortcut": null,
      "description": "Reduce the amount of output and no statistics.",
      "value": null,
      "default": null
    },
    {
      "option": "--config-file",
      "shortcut": null,
      "description": "Config file to use during run.",
      "value": "string",
      "default": null
    },
    {
      "option": "--config-file-url",
      "shortcut": null,
      "description": "Config file to download from a remote location. Must be json or yaml.",
      "value": "string",
      "default": null
    },
    {
      "option": "--custom-check-dir",
      "shortcut": null,
      "description": "Explicitly set the custom checks dir location.",
      "value": "string",
      "default": null
    },
    {
      "option": "--custom-check-url",
      "shortcut": null,
      "description": "Download a custom check file from a remote location. Must be json or yaml.",
      "value": "string",
      "default": null
    },
    {
      "option": "--debug",
      "shortcut": null,
      "description": "Enable debug logging (same as verbose).",
      "value": null,
      "default": null
    },
    {
      "option": "--disable-grouping",
      "shortcut": "-G",
      "description": "Disable grouping of similar results.",
      "value": null,
      "default": null
    },
    {
      "option": "--exclude",
      "shortcut": "-e",
      "description": "Provide comma-separated list of rule IDs to exclude from run.",
      "value": "string",
      "default": null
    },
    {
      "option": "--exclude-downloaded-modules",
      "shortcut": null,
      "description": "Remove results for downloaded modules in .terraform folder.",
      "value": null,
      "default": null
    },
    {
      "option": "--exclude-path",
      "shortcut": null,
      "description": "Folder path to exclude, can be used multiple times and evaluated in order of specification.",
      "value": "strings",
      "default": null
    },
    {
      "option": "--filter-results",
      "shortcut": null,
      "description": "Filter results to return specific checks only (supports comma-delimited input).",
      "value": "string",
      "default": null
    },
    {
      "option": "--force-all-dirs",
      "shortcut": null,
      "description": "Don't search for tf files, include everything below provided directory.",
      "value": null,
      "default": null
    },
    {
      "option": "--help",
      "shortcut": "-h",
      "description": "help for tfsec.",
      "value": null,
      "default": null
    },
    {
      "option": "--ignore-hcl-errors",
      "shortcut": null,
      "description": "Do not report an error if an HCL parse error is encountered.",
      "value": null,
      "default": null
    },
    {
      "option": "--include-ignored",
      "shortcut": null,
      "description": "Include ignored checks in the result output.",
      "value": null,
      "default": null
    },
    {
      "option": "--include-passed",
      "shortcut": null,
      "description": "Include passed checks in the result output.",
      "value": null,
      "default": null
    },
    {
      "option": "--migrate-ignores",
      "shortcut": null,
      "description": "Migrate ignore codes to the new ID structure.",
      "value": null,
      "default": null
    },
    {
      "option": "--minimum-severity",
      "shortcut": "-m",
      "description": "The minimum severity to report. One of CRITICAL, HIGH, MEDIUM, LOW.",
      "value": "string",
      "default": null
    },
    {
      "option": "--no-code",
      "shortcut": null,
      "description": "Don't include the code snippets in the output.",
      "value": null,
      "default": null
    },
    {
      "option": "--no-color",
      "shortcut": "-no-colour",
      "description": "Disable colored output (American style!).",
      "value": null,
      "default": null
    },
    {
      "option": "--no-ignores",
      "shortcut": null,
      "description": "Do not apply any ignore rules - normally ignored checks will fail.",
      "value": null,
      "default": null
    },
    {
      "option": "--no-module-downloads",
      "shortcut": null,
      "description": "Do not download remote modules.",
      "value": null,
      "default": null
    },
    {
      "option": "--out",
      "shortcut": "-O",
      "description": "Set output file. This filename will have a format descriptor appended if multiple formats are specified with --format.",
      "value": "string",
      "default": null
    },
    {
      "option": "--print-rego-input",
      "shortcut": null,
      "description": "Print a JSON representation of the input supplied to rego policies.",
      "value": null,
      "default": null
    },
    {
      "option": "--rego-only",
      "shortcut": null,
      "description": "Run rego policies exclusively.",
      "value": null,
      "default": null
    },
    {
      "option": "--rego-policy-dir",
      "shortcut": null,
      "description": "Directory to load rego policies from (recursively).",
      "value": "string",
      "default": null
    },
    {
      "option": "--run-statistics",
      "shortcut": null,
      "description": "View statistics table of current findings.",
      "value": null,
      "default": null
    },
    {
      "option": "--single-thread",
      "shortcut": null,
      "description": "Run checks using a single thread.",
      "value": null,
      "default": null
    },
    {
      "option": "--soft-fail",
      "shortcut": "-s",
      "description": "Runs checks but suppresses error code.",
      "value": null,
      "default": null
    },
    {
      "option": "--tfvars-file",
      "shortcut": null,
      "description": "Path to .tfvars file, can be used multiple times and evaluated in order of specification.",
      "value": "strings",
      "default": null
    },
    {
      "option": "--update",
      "shortcut": null,
      "description": "Update to latest version.",
      "value": null,
      "default": null
    },
    {
      "option": "--var-file",
      "shortcut": null,
      "description": "Path to .tfvars file, can be used multiple times and evaluated in order of specification (same functionality as --tfvars-file but consistent with Terraform).",
      "value": "strings",
      "default": null
    },
    {
      "option": "--verbose",
      "shortcut": null,
      "description": "Enable verbose logging (same as debug).",
      "value": null,
      "default": null
    },
    {
      "option": "--version",
      "shortcut": "-v",
      "description": "Show version information and exit.",
      "value": null,
      "default": null
    },
    {
      "option": "--workspace",
      "shortcut": "-w",
      "description": "Specify a workspace for ignore limits.",
      "value": "string",
      "default": "default"
    }
  ],
  "raw_help_text": "tfsec is a simple tool to detect potential security vulnerabilities in your terraformed infrastructure.\n\nUsage:\n  tfsec [directory] [flags]\n\nFlags:\n      --code-theme string            Theme for annotated code. Either 'light' or 'dark'. (default \"dark\")\n      --concise-output               Reduce the amount of output and no statistics\n      --config-file string           Config file to use during run\n      --config-file-url string       Config file to download from a remote location. Must be json or yaml\n      --custom-check-dir string      Explicitly set the custom checks dir location\n      --custom-check-url string      Download a custom check file from a remote location. Must be json or yaml\n      --debug                        Enable debug logging (same as verbose)\n  -G, --disable-grouping             Disable grouping of similar results\n  -e, --exclude string               Provide comma-separated list of rule IDs to exclude from run.\n      --exclude-downloaded-modules   Remove results for downloaded modules in .terraform folder\n      --exclude-path strings         Folder path to exclude, can be used multiple times and evaluated in order of specification\n      --filter-results string        Filter results to return specific checks only (supports comma-delimited input).\n      --force-all-dirs               Don't search for tf files, include everything below provided directory.\n  -f, --format string                Select output format: lovely, json, csv, checkstyle, junit, sarif, text, markdown, html, gif. To use multiple formats, separate with a comma and specify a base output filename with --out. A file will be written for each type. The first format will additionally be written stdout. (default \"lovely\")\n  -h, --help                         help for tfsec\n      --ignore-hcl-errors            Do not report an error if an HCL parse error is encountered\n      --include-ignored              Include ignored checks in the result output\n      --include-passed               Include passed checks in the result output\n      --migrate-ignores              Migrate ignore codes to the new ID structure\n  -m, --minimum-severity string      The minimum severity to report. One of CRITICAL, HIGH, MEDIUM, LOW.\n      --no-code                      Don't include the code snippets in the output.\n      --no-color                     Disable colored output (American style!)\n      --no-colour                    Disable coloured output\n      --no-ignores                   Do not apply any ignore rules - normally ignored checks will fail\n      --no-module-downloads          Do not download remote modules.\n  -O, --out string                   Set output file. This filename will have a format descriptor appended if multiple formats are specified with --format\n      --print-rego-input             Print a JSON representation of the input supplied to rego policies.\n      --rego-only                    Run rego policies exclusively.\n      --rego-policy-dir string       Directory to load rego policies from (recursively).\n      --run-statistics               View statistics table of current findings.\n      --single-thread                Run checks using a single thread\n  -s, --soft-fail                    Runs checks but suppresses error code\n      --tfvars-file strings          Path to .tfvars file, can be used multiple times and evaluated in order of specification\n      --update                       Update to latest version\n      --var-file strings             Path to .tfvars file, can be used multiple times and evaluated in order of specification (same functionaility as --tfvars-file but consistent with Terraform)\n      --verbose                      Enable verbose logging (same as debug)\n  -v, --version                      Show version information and exit\n  -w, --workspace string             Specify a workspace for ignore limits (default \"default\")",
  "aliases": []
}
